日付,曜日,配信時刻,記事ID,タイトル,カテゴリー,閲覧数24h,閲覧数7d,閲覧数累計,購入数,購入率(%),収益(円),Twitter_RT,Twitter_いいね,ステータス,メモ
2025-11-03,月,09:00,1,銀行口座で絶対にやってはいけないこと,A_お金,,,,,,,,,,
2025-11-03,月,12:00,21,転職で絶対に失敗する面接回答,B_ビジネス,,,,,,,,,,
2025-11-03,月,20:00,66,家事で絶対にやってはいけない時短テク,E_生活,,,,,,,,,,
2025-11-04,火,09:00,36,ダイエットで絶対失敗する食事法,C_健康,,,,,,,,,,
2025-11-04,火,12:00,51,マッチングアプリで絶対モテないプロフィール,D_恋愛,,,,,,,,,,
2025-11-04,火,20:00,2,クレジットカードで損する使い方,A_お金,,,,,,,,,,
2025-11-05,水,09:00,22,履歴書・職務経歴書で損する書き方,B_ビジネス,,,,,,,,,,
2025-11-05,水,12:00,76,ゲーム課金で絶対に損する罠,E_生活,,,,,,,,,,
2025-11-05,水,20:00,37,筋トレで逆効果になる間違い,C_健康,,,,,,,,,,
2025-11-06,木,09:00,3,投資信託で絶対避けたい銘柄選び,A_お金,,,,,,,,,,
2025-11-06,木,12:00,52,デートで絶対失敗する会話術,D_恋愛,,,,,,,,,,
2025-11-06,木,20:00,67,子どものお小遣いで損しない渡し方,E_生活,,,,,,,,,,
2025-11-07,金,09:00,23,年収交渉で絶対やってはいけないこと,B_ビジネス,,,,,,,,,,
2025-11-07,金,12:00,38,サプリで損する選び方,C_健康,,,,,,,,,,
2025-11-07,金,20:00,53,告白で絶対振られるタイミング,D_恋愛,,,,,,,,,,
2025-11-08,土,10:00,77,映画・漫画で知らないと損する裏設定,E_生活,,,,,,,,,,
2025-11-08,土,14:00,54,結婚で損する相手の見極め方,D_恋愛,,,,,,,,,,
2025-11-08,土,19:00,39,スキンケアで逆に肌が荒れるNG習慣,C_健康,,,,,,,,,,
2025-11-09,日,10:00,4,ポイント還元で損するパターン,A_お金,,,,,,,,,,
2025-11-09,日,14:00,78,音楽ストリーミングで損しない聴き方,E_生活,,,,,,,,,,
2025-11-09,日,19:00,40,睡眠で絶対やってはいけないこと,C_健康,,,,,,,,,,
2025-11-10,月,09:00,5,年金で知らないと損する裏技,A_お金,,,,,,,,,,
2025-11-10,月,12:00,24,退職で損する辞め方,B_ビジネス,,,,,,,,,,
2025-11-10,月,20:00,68,掃除で逆に汚くなるNG習慣,E_生活,,,,,,,,,,
2025-11-11,火,09:00,41,プロテインで損する飲み方,C_健康,,,,,,,,,,
2025-11-11,火,12:00,55,別れ話で絶対やってはいけないこと,D_恋愛,,,,,,,,,,
2025-11-11,火,20:00,6,保険で絶対入ってはいけないプラン,A_お金,,,,,,,,,,
2025-11-12,水,09:00,25,副業で絶対選んではいけない案件,B_ビジネス,,,,,,,,,,
2025-11-12,水,12:00,79,スポーツ観戦で得する裏テク,E_生活,,,,,,,,,,
2025-11-12,水,20:00,42,ランニングで絶対やってはいけないフォーム,C_健康,,,,,,,,,,
2025-11-13,木,09:00,7,税金で損する確定申告のミス,A_お金,,,,,,,,,,
2025-11-13,木,12:00,56,友達関係で損する距離感,D_恋愛,,,,,,,,,,
2025-11-13,木,20:00,69,光熱費で損する契約の落とし穴,E_生活,,,,,,,,,,
2025-11-14,金,09:00,26,起業で失敗する初心者の罠,B_ビジネス,,,,,,,,,,
2025-11-14,金,12:00,43,美容医療で失敗するクリニック選び,C_健康,,,,,,,,,,
2025-11-14,金,20:00,57,LINE・SNSで嫌われるメッセージ,D_恋愛,,,,,,,,,,
2025-11-15,土,10:00,80,旅行で絶対避けたい予約ミス,E_生活,,,,,,,,,,
2025-11-15,土,14:00,58,飲み会で絶対嫌われる行動,D_恋愛,,,,,,,,,,
2025-11-15,土,19:00,44,ヘアケアで逆に髪が傷む習慣,C_健康,,,,,,,,,,
2025-11-16,日,10:00,8,FXで絶対やってはいけないこと,A_お金,,,,,,,,,,
2025-11-16,日,14:00,81,カフェや飲食で知らないと損する裏ワザ,E_生活,,,,,,,,,,
2025-11-16,日,19:00,45,コスメ選びで損する成分の罠,C_健康,,,,,,,,,,
2025-11-17,月,09:00,9,暗号資産で失敗する初心者の罠,A_お金,,,,,,,,,,
2025-11-17,月,12:00,27,フリーランスで損する契約書の穴,B_ビジネス,,,,,,,,,,
2025-11-17,月,20:00,70,家計管理で絶対やってはいけないこと,E_生活,,,,,,,,,,
2025-11-18,火,09:00,46,腸活で逆効果になる食べ方,C_健康,,,,,,,,,,
2025-11-18,火,12:00,59,謝罪で逆に怒られるパターン,D_恋愛,,,,,,,,,,
2025-11-18,火,20:00,10,不動産投資で絶対避けたい物件,A_お金,,,,,,,,,,
2025-11-19,水,09:00,28,資格取得で絶対無駄になる選び方,B_ビジネス,,,,,,,,,,
2025-11-19,水,12:00,82,DIYで絶対やってはいけない失敗例,E_生活,,,,,,,,,,
2025-11-19,水,20:00,47,メンタルヘルスで絶対やってはいけないこと,C_健康,,,,,,,,,,
2025-11-20,木,09:00,11,住宅ローンで損する契約内容,A_お金,,,,,,,,,,
2025-11-20,木,12:00,60,プレゼント選びで絶対失敗する基準,D_恋愛,,,,,,,,,,
2025-11-20,木,20:00,71,知らないと損する買い物の裏ワザ,E_生活,,,,,,,,,,
2025-11-21,金,09:00,29,昇進で損する働き方,B_ビジネス,,,,,,,,,,
2025-11-21,金,12:00,48,歯のケアで損する習慣,C_健康,,,,,,,,,,
2025-11-21,金,20:00,61,家族関係で絶対やってはいけないこと,D_恋愛,,,,,,,,,,
2025-11-22,土,10:00,83,写真撮影で絶対失敗する構図,E_生活,,,,,,,,,,
2025-11-22,土,14:00,62,ママ友・パパ友で損する付き合い方,D_恋愛,,,,,,,,,,
2025-11-22,土,19:00,49,ストレス解消で逆効果な方法,C_健康,,,,,,,,,,
2025-11-23,日,10:00,12,NISAで知らないと損する落とし穴,A_お金,,,,,,,,,,
2025-11-23,日,14:00,84,ペット飼育で知らないと損する習慣,E_生活,,,,,,,,,,
2025-11-23,日,19:00,50,アンチエイジングで損する習慣,C_健康,,,,,,,,,,
2025-11-24,月,09:00,13,iDeCoで絶対失敗する運用法,A_お金,,,,,,,,,,
2025-11-24,月,12:00,30,職場の人間関係で絶対やってはいけないこと,B_ビジネス,,,,,,,,,,
2025-11-24,月,20:00,72,料理で絶対失敗するパターン,E_生活,,,,,,,,,,
2025-11-25,火,09:00,86,政治ニュースで絶対騙される落とし穴,E_生活,,,,,,,,,,
2025-11-25,火,12:00,63,嫌いな人への対処で損する方法,D_恋愛,,,,,,,,,,
2025-11-25,火,20:00,14,副業の確定申告で絶対やってはいけないこと,A_お金,,,,,,,,,,
2025-11-26,水,09:00,31,テレワークで損する働き方,B_ビジネス,,,,,,,,,,
2025-11-26,水,12:00,87,詐欺メール・SMSの見抜き方,E_生活,,,,,,,,,,
2025-11-26,水,20:00,73,家庭内トラブルを避ける心理テク,E_生活,,,,,,,,,,
2025-11-27,木,09:00,15,節税で逆に損する方法,A_お金,,,,,,,,,,
2025-11-27,木,12:00,64,ご近所トラブルで絶対やってはいけないこと,D_恋愛,,,,,,,,,,
2025-11-27,木,20:00,88,ネット広告で損するクリックパターン,E_生活,,,,,,,,,,
2025-11-28,金,09:00,32,会議で絶対失敗する発言パターン,B_ビジネス,,,,,,,,,,
2025-11-28,金,12:00,65,会話で絶対嫌われる話し方,D_恋愛,,,,,,,,,,
2025-11-28,金,20:00,89,アプリ課金で知らないと損する裏仕様,E_生活,,,,,,,,,,
2025-11-29,土,10:00,74,収納で逆に散らかる落とし穴,E_生活,,,,,,,,,,
2025-11-29,土,14:00,90,クラウドサービスで絶対避ける落とし穴,E_生活,,,,,,,,,,
2025-11-29,土,19:00,85,趣味グッズ購入で損しないチェックリスト,E_生活,,,,,,,,,,
2025-11-30,日,10:00,16,相続で絶対やってはいけないこと,A_お金,,,,,,,,,,
2025-11-30,日,14:00,91,ネット上の人間関係で損しない心理テク,E_生活,,,,,,,,,,
2025-11-30,日,19:00,75,時短家事でやりがちな損パターン,E_生活,,,,,,,,,,
2025-12-01,月,09:00,17,生命保険で損する見直しパターン,A_お金,,,,,,,,,,
2025-12-01,月,12:00,33,上司への報告で損するタイミング,B_ビジネス,,,,,,,,,,
2025-12-01,月,20:00,92,SNS炎上で絶対やってはいけない返信,E_生活,,,,,,,,,,
2025-12-02,火,09:00,18,電子マネーで知らないと損する裏技,A_お金,,,,,,,,,,
2025-12-02,火,12:00,34,ビジネスメールで絶対やってはいけないこと,B_ビジネス,,,,,,,,,,
2025-12-02,火,20:00,93,知らないと損する交通トラブルの裏ルール,E_生活,,,,,,,,,,
