"Text","Image URL","Tags","Posting Time"
"「今日から二人だね」
夫がポツリと言った。

子供が大学進学で家を出た。
ガランとした子供部屋。
夫と二人きりの食卓。
カチャカチャという食器の音だけが響く。

何を話せばいいの？
子供の話以外、共通の話題がない。
これから何十年も、この沈黙が続くの？
息が詰まりそう。

私の実体験はプロフの固定投稿へ。
#空の巣症候群 #熟年夫婦 #会話なし #問題","","Week7-8_Day43-60","2026-01-17 08:38"
"おはようございます。
お弁当を作らなくていい朝。
楽だけど、少し寂しい。
夫の分だけ作る卵焼き。
形が崩れちゃった。
まあ、食べてくれるだけマシか。
今日も無理せずいきましょう。","","Week7-8_Day43-60","2026-01-17 10:13"
"【質問】
子供が巣立った後の夫婦生活、想像できますか？

1. 楽しみ（自由だ！旅行行くぞ！）
2. 不安（間が持たない...）
3. 考えたくない（恐怖）

正直に教えてください🙋‍♀️","","Week7-8_Day43-60","2026-01-17 12:07"
"子供中心の生活が終わると、喪失感に襲われます。
でも、それは自由への扉でもあります。

趣味に没頭する、習い事を始める。
夫を気にせず、自分の時間を楽しむ。
あなたが輝けば、夫も変わります。
「自立した大人同士」の関係を築きましょう。
第二の青春、始めませんか？




「子供が巣立った後の『夫婦の沈黙』を破る！第二の人生を楽しむ『リスタート術』」
具体的な方法はNoteで公開中。
#セカンドライフ #夫婦の時間 #解決策","","Week7-8_Day43-60","2026-01-17 14:18"
"夫が「映画でも行くか」って。
20年ぶり？
ポップコーン食べる手が触れてドキッとした。
まだときめけるんだ、私。
捨てたもんじゃないね。
共感したら「いいね」お願いします。","","Week7-8_Day43-60","2026-01-17 16:23"
"夕方のこの時間。
夕飯の支度が楽になった。
手抜き料理でも文句言われない。
これぞ自由の味。
ワインでも開けちゃおうかな。
乾杯。","","Week7-8_Day43-60","2026-01-17 19:12"
"夫婦二人きりの生活に戸惑うあなたへ。

まずは労いの言葉をかけ合いましょう。
「子育て頑張ったね」
「仕事続けてくれてありがとう」
戦友としての絆を確認する。
そこから、新しい愛が始まります。
照れくさいけど、言ってみて。




「子供が巣立った後の『夫婦の沈黙』を破る！第二の人生を楽しむ『リスタート術』」
解決のための「3つのステップ」をNoteにまとめました。
▼記事はプロフのリンクから
#夜専用レス手前の会話レシピ","","Week7-8_Day43-60","2026-01-17 20:29"
"夜のリビング。
昔のアルバムを二人で見た。
「若かったなー」って笑い合った。
歴史を共有できるのは、あなただけ。
シワの数だけ、思い出がある。
同じ気持ちの人、いますか？","","Week7-8_Day43-60","2026-01-17 21:37"
"今日もお疲れ様でした。
人生はまだまだ続く。
隣にいる人と、笑って過ごそう。
おやすみなさい。","","Week7-8_Day43-60","2026-01-17 22:48"
"明日は今日より少しだけ、心が軽くなりますように。
新しい朝が、待ち遠しくなりますように。
プロフの固定投稿もぜひ。
おやすみなさい。","","Week7-8_Day43-60","2026-01-17 23:33"
