"Text","Image URL","Tags","Posting Time"
"「子育てが終わったら、私たちに何が残るんだろう？」




今は子供の話題で繋がっているけれど。
それがなくなったら、共通の話題なんてない。
想像するだけで、胸がざわざわする。

「おーい」と呼んでも、返事がない未来。
ただテレビの音だけが響くリビング。
そんな老後は嫌だ。でも、どうすればいいかわからない。

私の実体験はプロフの固定投稿へ。
#空の巣症候群 #熟年離婚 #夫婦の危機 #問題","","Week5_Day29-35","2025-12-21 08:43"
"おはようございます。
未来の不安より、今のコーヒー。
まずは今日一日、心地よく過ごすことだけ考えましょう。
今日も無理せずいきましょう。","","Week5_Day29-35","2025-12-21 10:17"
"【質問】
子どもがいない時、夫婦の会話は弾みますか？

1. 弾む
2. 業務連絡のみ
3. 無言

正直に教えてください🙋‍♀️","","Week5_Day29-35","2025-12-21 12:13"
"「空の巣」は終わりではなく、第二章の始まりです。
恋人時代に戻るのではなく、新しい関係を作るチャンス。

まずは「子供抜きの会話」のリハビリから。
「今日の天気」でも「ニュース」でもいい。
「パパ・ママ」ではなく、名前で呼び合うことから始めてみませんか？




「子どもが巣立った後の夫婦関係を、劇的に良くする3つの準備」
具体的な方法はNoteで公開中。
#空の巣症候群 #夫婦の再構築 #解決策","","Week5_Day29-35","2025-12-21 15:07"
"夫と二人きりの車内。
ラジオだけが流れる気まずい時間。
昔はドライブデート楽しかったのになぁ。
これ、あるあるですよね。
共感したら「いいね」お願いします。","","Week5_Day29-35","2025-12-21 18:18"
"夕方のこの時間。
子供の帰りを待つ時間も、あと数年かな。
今の騒がしさを、少しだけ愛おしく思う。
小さな変化が大事です。","","Week5_Day29-35","2025-12-21 20:14"
"二人きりの時間が怖いあなたへ。

無理に喋らなくていいんです。
「同じ空間にいても苦じゃない」
それが最初のゴールでいい。
焦らず、ゆっくり、二人のペースで。




「子どもが巣立った後の夫婦関係を、劇的に良くする3つの準備」
解決のための「3つのステップ」をNoteにまとめました。
▼記事はプロフのリンクから
#夜専用レス手前の会話レシピ","","Week5_Day29-35","2025-12-21 21:04"
"夜のリビング。
子供が塾でいない夜。
夫がお茶を淹れてくれた。
「ありがとう」と小さく言えた。
同じ気持ちの人、いますか？","","Week5_Day29-35","2025-12-21 22:07"
"今日もお疲れ様でした。
未来のことは誰にもわからない。
でも、今日の温もりは嘘じゃない。
おやすみなさい。","","Week5_Day29-35","2025-12-21 23:13"
"明日は今日より少しだけ、心が軽くなりますように。
二人の未来が、優しい色でありますように。
プロフの固定投稿もぜひ。
おやすみなさい。","","Week5_Day29-35","2025-12-21 23:13"
